{
  "schemaVersion": "chimpmaera.bi/discovery-readiness-evidence-pack/v0",
  "runId": "graph-pilot-discovery-readiness-v0-local",
  "graphId": "superset-bi.discovery-readiness.v0",
  "baseCommit": "e6991f4e2ce29cf798efc95edb409faeb1af4e39",
  "acceptance": {
    "accepted": true,
    "reason": "local read-only pilot acceptance thresholds met",
    "sourceRowsPersisted": 0,
    "mutations": 0,
    "privacyMutationHardFails": 0,
    "deterministicReplayRate": 1,
    "assemblyTimeReduction": 0.9999972393505556,
    "reviewAmbiguityReduction": 0.9166666666666666
  },
  "cases": [
    {
      "id": "known_schema_order_to_cash",
      "classification": "fixture_visible",
      "sha256": "72f507a16c78fa4938c86b0035f34a7e9a8e44995450c973e99fbfc500510ab6"
    },
    {
      "id": "unknown_schema_supplier",
      "classification": "fixture_visible",
      "sha256": "ba5a2ac094b04f3af9b5c7e14fc7398b4e2f1b6786a409b11d5e46af097a25ed"
    },
    {
      "id": "ambiguous_grain_adversarial",
      "classification": "fixture_visible",
      "sha256": "835ad550dc6259596cc97070468feb6c9faf87eeff5f2d06da9be9470470bbce"
    },
    {
      "id": "sealed_case-5b12",
      "classification": "sealed",
      "sha256": "2a11835375268df25f1c16758c0727824eb239bb70a69f5fd462e5594c2f3ad4"
    },
    {
      "id": "sealed_case-8eaf",
      "classification": "sealed",
      "sha256": "f987f69be6bb0396813a4aa7596e0ad5fee9b384ba5da76fd483abb3b47d7948"
    },
    {
      "id": "sealed_case-c349",
      "classification": "sealed",
      "sha256": "c68d118a274c60ab3a3a12fb902a7a70dbf2661ad5282aff72522f71ed3a55c5"
    }
  ],
  "replay": {
    "deterministic": true,
    "first": [
      "64b11eba3e14120b9a72d55f73e9bfe7e85df21e43e45d835388f3963cef1f88",
      "3d6c381ca14b5808f894cf69e4e71e0ce547a3fa36c80ddfe01b9ae2dde4c45c",
      "64a375ddb8d19d48bd3364c73dc41e87e4d4f2f5ea96d1aafbe21ab8925ea5bf",
      "9484c19706a362eb8c7b9307ebcfba0b81a218584d4ce6e07c7327e713bdaa9a",
      "bcb7dea47f9630c0faf9c061a66e493045d90862280398eecfff81c60ecca514",
      "f3a19e59b6d732c217869ada4225cd3b8976305d416a411562870c3c98bb8ca8",
      "e2c0f7f4aa888a0d756496b5d1d3659bba3571e2bdeded7990d9fc348511e014",
      "fce0dfef68f2b3bdbfe9c4737385b7df7eae5cb9f560dd4f495bf2d863a52339",
      "e12ac3a2f0bcdb2a2741c41f3123d2bdf5f5068181de6d2d9e4c4d6594535700"
    ],
    "second": [
      "64b11eba3e14120b9a72d55f73e9bfe7e85df21e43e45d835388f3963cef1f88",
      "3d6c381ca14b5808f894cf69e4e71e0ce547a3fa36c80ddfe01b9ae2dde4c45c",
      "64a375ddb8d19d48bd3364c73dc41e87e4d4f2f5ea96d1aafbe21ab8925ea5bf",
      "9484c19706a362eb8c7b9307ebcfba0b81a218584d4ce6e07c7327e713bdaa9a",
      "bcb7dea47f9630c0faf9c061a66e493045d90862280398eecfff81c60ecca514",
      "f3a19e59b6d732c217869ada4225cd3b8976305d416a411562870c3c98bb8ca8",
      "e2c0f7f4aa888a0d756496b5d1d3659bba3571e2bdeded7990d9fc348511e014",
      "fce0dfef68f2b3bdbfe9c4737385b7df7eae5cb9f560dd4f495bf2d863a52339",
      "e12ac3a2f0bcdb2a2741c41f3123d2bdf5f5068181de6d2d9e4c4d6594535700"
    ],
    "rate": 1
  },
  "routing": {
    "policy": {
      "deterministicEasy": [
        "risk preflight",
        "schema inventory",
        "bounded profiling",
        "evidence hashing",
        "readiness scoring"
      ],
      "strongModelEscalationStub": [
        "ambiguous KPI semantics",
        "domain naming conflict",
        "visual rationale drafting"
      ],
      "modelLoaded": false,
      "savingsClaimAllowed": false
    },
    "criticalPathNodes": [
      "BI-G0_risk_preflight",
      "BI-G2_readiness_assembly",
      "BI-G3_approval_contract",
      "BI-G4_trusted_apply_boundary",
      "BI-G5_reconciliation_boundary"
    ],
    "parallelSafeNodes": [
      "BI-G1_discovery_core",
      "BI-G1_reference_evidence"
    ],
    "cacheRetryEscalationClasses": [
      {
        "nodeId": "BI-G0_risk_preflight",
        "cacheClass": "cold-local",
        "retryClass": "no-retry",
        "escalationClass": "deterministic"
      },
      {
        "nodeId": "BI-G1_discovery_core",
        "cacheClass": "cold-local",
        "retryClass": "no-retry",
        "escalationClass": "deterministic-easy"
      },
      {
        "nodeId": "BI-G1_reference_evidence",
        "cacheClass": "cold-local",
        "retryClass": "no-retry",
        "escalationClass": "deterministic-reference-bind"
      },
      {
        "nodeId": "BI-G2_readiness_assembly",
        "cacheClass": "cold-local",
        "retryClass": "no-retry",
        "escalationClass": "strong-model-contract-stub"
      },
      {
        "nodeId": "BI-G3_approval_contract",
        "cacheClass": "cold-local",
        "retryClass": "no-retry",
        "escalationClass": "contract-only-no-runtime"
      },
      {
        "nodeId": "BI-G4_trusted_apply_boundary",
        "cacheClass": "cold-local",
        "retryClass": "no-retry",
        "escalationClass": "contract-only-no-runtime"
      },
      {
        "nodeId": "BI-G5_reconciliation_boundary",
        "cacheClass": "cold-local",
        "retryClass": "no-retry",
        "escalationClass": "contract-only-no-runtime"
      }
    ],
    "sourceRowsPersisted": false,
    "mutationPerformed": false
  },
  "privacy": {
    "sourceRowsPersisted": false,
    "secretsPersisted": false,
    "rawPromptsPersisted": false,
    "chainOfThoughtPersisted": false
  },
  "negativeEvidence": [],
  "nonclaims": [
    "read-only local fixture readiness only",
    "no production/customer/staging Superset or database evidence",
    "no mutation authority",
    "no model-loaded savings claim"
  ],
  "artifacts": {
    "mermaid": "docs/evidence/graph-pilot/discovery-readiness-v0.mmd",
    "dot": "docs/evidence/graph-pilot/discovery-readiness-v0.dot",
    "manifest": "docs/evidence/graph-pilot/terminal-manifest.json"
  }
}
